[
  {
    "id": 1,
    "title": "Metrics that matter",
    "domain": "Data / ML / Evaluation",
    "minutes": 20,
    "topics": [
      "Metrics & classification"
    ],
    "qs": [
      "q1",
      "q2",
      "q3",
      "q4",
      "q5"
    ]
  },
  {
    "id": 2,
    "title": "Validation, leakage & overfitting",
    "domain": "Data / ML / Evaluation",
    "minutes": 20,
    "topics": [
      "Validation & generalization"
    ],
    "qs": [
      "q6",
      "q7",
      "q8",
      "q9",
      "q10"
    ]
  },
  {
    "id": 3,
    "title": "Imbalance, preprocessing & thresholds",
    "domain": "Data / ML / Evaluation",
    "minutes": 25,
    "topics": [
      "Imbalance & model choice",
      "Preprocessing & thresholds"
    ],
    "qs": [
      "q11",
      "q12",
      "q13",
      "q14",
      "q15",
      "q16",
      "q17",
      "q18",
      "q19",
      "q20",
      "q21"
    ]
  },
  {
    "id": 4,
    "title": "Neural networks in one mental model",
    "domain": "Core AI / Deep Learning / GenAI",
    "minutes": 20,
    "topics": [
      "Neural network basics",
      "Sequence & CNN models"
    ],
    "qs": [
      "q22",
      "q23",
      "q24",
      "q25",
      "q26",
      "q27",
      "q28",
      "q29",
      "q30",
      "q31"
    ]
  },
  {
    "id": 5,
    "title": "Transformers → RAG → Agents",
    "domain": "Core AI / Deep Learning / GenAI",
    "minutes": 25,
    "topics": [
      "Transformers",
      "RAG, grounding & tools"
    ],
    "qs": [
      "q32",
      "q33",
      "q34",
      "q35",
      "q36",
      "q37",
      "q38",
      "q39",
      "q40",
      "q41"
    ]
  },
  {
    "id": 6,
    "title": "Reliable AI APIs",
    "domain": "AI Software Engineering",
    "minutes": 25,
    "topics": [
      "Async, queues & reliability",
      "API safety & testing"
    ],
    "qs": [
      "q42",
      "q43",
      "q44",
      "q45",
      "q46",
      "q47",
      "q48",
      "q49",
      "q50",
      "q51",
      "q52",
      "q53",
      "q54",
      "q55",
      "q56",
      "q57",
      "q58"
    ]
  },
  {
    "id": 7,
    "title": "MLOps lifecycle & registry",
    "domain": "MLOps / LLMOps",
    "minutes": 25,
    "topics": [
      "MLOps lifecycle"
    ],
    "qs": [
      "q59",
      "q60",
      "q61",
      "q62",
      "q63",
      "q64",
      "q65",
      "q66",
      "q67",
      "q68",
      "q69"
    ]
  },
  {
    "id": 8,
    "title": "Deployment, drift & LLMOps",
    "domain": "MLOps / LLMOps",
    "minutes": 25,
    "topics": [
      "Deployment, drift & LLMOps"
    ],
    "qs": [
      "q70",
      "q71",
      "q72",
      "q73",
      "q74",
      "q75",
      "q76",
      "q77",
      "q78",
      "q79",
      "q80"
    ]
  },
  {
    "id": 9,
    "title": "Scaling & latency",
    "domain": "Architecture / Infrastructure",
    "minutes": 20,
    "topics": [
      "Scaling & performance"
    ],
    "qs": [
      "q81",
      "q82",
      "q83",
      "q84",
      "q85",
      "q86",
      "q87",
      "q88"
    ]
  },
  {
    "id": 10,
    "title": "Availability, RTO & RPO",
    "domain": "Architecture / Infrastructure",
    "minutes": 20,
    "topics": [
      "Availability & recovery"
    ],
    "qs": [
      "q89",
      "q90",
      "q91",
      "q92",
      "q93",
      "q94",
      "q95"
    ]
  },
  {
    "id": 11,
    "title": "Responsible AI & privacy",
    "domain": "Responsible AI / Security / Governance",
    "minutes": 20,
    "topics": [
      "Responsible AI & privacy"
    ],
    "qs": [
      "q96",
      "q97",
      "q98",
      "q99",
      "q100",
      "q101",
      "q102",
      "q103",
      "q104"
    ]
  },
  {
    "id": 12,
    "title": "Prompt injection & agent security",
    "domain": "Responsible AI / Security / Governance",
    "minutes": 25,
    "topics": [
      "LLM/Agent security"
    ],
    "qs": [
      "q105",
      "q106",
      "q107",
      "q108",
      "q109",
      "q110",
      "q111",
      "q112",
      "q113"
    ]
  },
  {
    "id": 13,
    "title": "Business decisions & trade-offs",
    "domain": "Business / Professional Practice",
    "minutes": 20,
    "topics": [
      "Business & collaboration"
    ],
    "qs": [
      "q114",
      "q115",
      "q116",
      "q117",
      "q118",
      "q119",
      "q120",
      "q121"
    ]
  },
  {
    "id": 14,
    "title": "Adaptive weak-topic review",
    "domain": "Adaptive",
    "minutes": 20,
    "topics": [],
    "qs": []
  },
  {
    "id": 15,
    "title": "Weighted mixed mock",
    "domain": "All",
    "minutes": 30,
    "topics": [],
    "qs": []
  }
]
